programme,acronym,project_title,abstract,researcher,host_institution,country,region,project_number,call,instrument,research_domain,panel,call_year,start_date,end_date,amount_granted,cordis_link,snsf_institution
Horizon 2020,DISCOVERHEP,Turning noise into data: a discovery strategy for new weakly-interacting physics,"The ATLAS and CMS Experiments at the Large Hadron Collider (LHC) have done an excellent job in searching for new high-energy physics, pushing out to energy scales which have never before been studied. In contrast, low-energy physics has only been studied in specific contexts at the LHC, and remains largely uncovered in the search for new physics. Despite the main focus being on the high-energy regime, it is entirely possible that new physics is instead hiding in the low-energy regime, and it was not observed in previous collider physics experiments due to being rarely produced.

In the context of the DISCOVERHEP project, I will lead a group in the search for new physics in the largely-uncovered low-energy regime. The project will exploit the very-high LHC beam intensity to turn ""noise"", in the form of traditionally unwanted and ignored additional simultaneous proton-proton collisions, into a currently-untapped wealth of useful low-energy physics data. This novel approach thereby opens up the possibility of conducting high-sensitivity searches for low-energy physics at the LHC.

This massive low-energy physics dataset will be used to enable the project goals, in the form of searches for new low-energy weakly-interacting physics conducted using the ATLAS Detector. Three different search strategies, sensitive to different types of new physics, are considered: two types of direct searches for new light particles such as potential mediators between the Standard Model and Dark Matter, and one generic search for new low-energy physics using anomaly detection techniques. These searches will dramatically extend the sensitivity of ATLAS to new low-energy physics, thus expanding the ATLAS physics program and potentially leading the way towards new discoveries.",Steven Schramm,University of Geneva,Switzerland,-,948254,ERC-2020-STG,Starting Grants,Physical sciences & engineering (PE),PE2 - Fundamental Constituents of Matter,2020,44287,46112,1499975,https://cordis.europa.eu/project/id/948254,University of Geneva
Horizon 2020,KAIROS,"Bootstrapping Time: Colliders, Shocks, Strings, and Black Holes","Two pillars of modern physics are Quantum Field Theory (QFT) and General Relativity (GR). Together they describe a vast corpus of phenomena ranging from the smallest scales accessible with modern accelerators to the largest distances observed with modern telescopes. Establishing these frameworks is a triumph of 20th-century physics.   Our understanding of both is not satisfactory. On the QFT side, we lack tools to analyze the strong coupling regime. On the GR side, we do not understand how to make it quantum. The insight of holography is that these two problems are deeply connected, in other words, QFT and Quantum Gravity (QG) are different realizations of the same underlying mathematical structure and physical principles. Providing us with this fundamental insight, holography does not tell us what the underlying structure is. The challenge for 21st-century physics is to understand it.    The aim of the present proposal is to establish a research team at CERN that: a) will {\it develop new nonperturbative Lorentzian bootstrap methods} as a part of a larger quest of revealing the unifying mathematical structure and physical principles that underlie both QFT and QG; b) use these methods for state-of-the-art {\it computations of  real-time physical observables} which are not accessible using conventional methods. This will lead to new insights into the fundamental properties of QFT, QG, and holography which relates the two. The principal novelty of the project is in its focus on the nonperturbative real-time dynamics, as opposed to Euclidean observables which are typically studied using the current bootstrap or other methods.   Bootstrap takes fundamental principles of physics, such as causality, locality, and unitarity, and pushes their consequences to the extreme. Combined with insights from holography, bootstrap methods offer an unprecedented set of tools for diving into uncharted territories of QFT and QG.",Alexander Zhiboedov,European Organization for Nuclear Research (CERN),Switzerland,-,949077,ERC-2020-STG,Starting Grants,Physical sciences & engineering (PE),PE2 - Fundamental Constituents of Matter,2020,44197,46022,1455000,https://cordis.europa.eu/project/id/949077,European Organization for Nuclear Research (CERN)
Horizon 2020,FASERnu,Studying Neutrinos at the High Energy Frontier,"Although the properties of neutrinos have been intensively studied, we are still missing data about their behaviour in the TeV energy scale, as well as conclusive tests of lepton universality in neutrino scattering. Embracing the discussions on recently identified flavour anomalies, which hint at lepton universality violation, the study of high-energy neutrino interactions involving both heavy leptons and heavy quarks may be a powerful and complementary tool to search for new physics effects. Such interaction channels require high neutrino energy. 
Here I propose to measure high energy neutrinos with a detector sensitive to heavy flavour particles. This project (FASERnu) employs a novel approach to exploit the CERN Large Hadron Collider (LHC) as an intense neutrino source, which allows for the study of the high energy frontier of man-made neutrinos. An emulsion hybrid neutrino detector with a target mass of 1.2 tonnes will be employed. Such a detector structure has been well proven to be sensitive to heavy flavour particles: tau, charm and beauty. Data taking will be carried out during the forthcoming Run 3 of LHC operation (2021-2024), which would yield >20,000 neutrino interactions in the detector. During the timeline of this grant, neutrino cross sections will be measured for all three flavours in the uncharted energy range between 360 GeV and 6 TeV. Furthermore, the channels associated with heavy quark (charm and beauty) production will be studied. 
I established this project within the framework of the FASER experiment. The letter of intent and technical proposal of this project were approved by the CERN committees and I presently act as one of the project leaders of the neutrino program in FASER. FASERnu will not only investigate an unexplored energy regime, but will also provide relevant inputs to future neutrino experiments at the High-Luminosity-LHC (HL-LHC) and then at the Future Circular Collider (FCC).",Akitaka Ariga,University of Bern,Switzerland,-,101002690,ERC-2020-COG,Consolidator Grants,Physical sciences & engineering (PE),PE2 - Fundamental Constituents of Matter,2020,44440,46265,1998125,https://cordis.europa.eu/project/id/101002690,University of Berne
Horizon 2020,TOPUP,Theory of particle collider processes at ultimate precision,"The Large Hadron Collider (LHC) at CERN probes the interaction of elementary particles at unprecedented energy and to very high precision. The full exploitation of the upcoming data from the LHC relies on a close interplay between theory and experiment, which calls in particular for highly accurate theoretical predictions. This theoretical accuracy can be achieved only though the expansion of the fundamental scattering amplitudes to sufficiently high order in perturbation theory.

This project aims to meet this challenge for modern collider physics by providing the conceptual and technical foundations for theory predictions at ultimate precision. TOPUP will develop and establish a new standard of theoretical precision in the description of physical observables at the LHC based on perturbation theory expanded to the third non-trivial order (N3LO). We will achieve this ambitious goal by targeting the main obstacles in present-day methods, and by developing novel ways for the computation of multi-loop scattering amplitudes and in the understanding and handling of unresolved multi-particle emission.

The concrete goal of the project is to enable theoretical predictions at ultimate precision for multiple processes in high-energy particle collisions with full final state kinematical information. This will lead to a more precise extraction of fundamental physics parameters, such as couplings and particle masses. The newly developed methods will be applied to the derivation of the process-independent four-loop corrections to the Altarelli-Parisi splitting functions, the three-loop matrix elements for a number of fundamental scattering processes and fully differential N3LO predictions for several process-specific key observables. These calculations will shape and challenge the newly developed methods in cutting-edge applications and provide crucial input to the theoretical interpretation of the LHC precision physics program.",Thomas Kurt Gehrmann,University of Zurich,Switzerland,-,101019620,ERC-2020-ADG,Advanced Grants,Physical sciences & engineering (PE),PE2 - Fundamental Constituents of Matter,2020,44440,46265,2459915,https://cordis.europa.eu/project/id/101019620,University of Zurich
Horizon 2020,TANQ,Taming Non-Equilibrium Quantum Matter,"Recent experimental breakthroughs led to realization of tunable, synthetic quantum systems that allow one to probe and manipulate highly non-equilibrium quantum matter. Driving a system ouf-of-equilibrium changes its properties in unexpected ways, opening opportunities for realizing new states of matter. The central goal of this project is to develop a fundamental theoretical understanding of non-equilibrium dynamics and highly excited eigenstates in quantum many-body systems. The conventional wisdom tells that a non-equilibrium system thermalizes, and can then be described by statistical-mechanics. However, recent breakthroughs revealed an experimentally relevant class of systems, the prime example being disordered, many-body localized (MBL) systems, which defy this wisdom, avoiding thermalization. Ergodicity-breaking systems open new avenues for protecting quantum coherence, and for realizing new non-equilibrium phases of matter. We will study the fundamental mechanisms of ergodicity breaking using a multi-disciplinary approach, which builds on techniques from quantum information, condensed matter physics, quantum optics and mathematical physics. We aim to establish universality classes of quantum dynamics, by studying disordered systems with symmetries, and by characterizing entirely new mechanisms of ergodicity breaking, such as quantum many-body scars. In order to overcome the exponential growth of the many-body Hilbert space, new efficient renormalization and tensor-network methods based on quantum entanglement will be developed. Finally, approaches for manipulating quantum matter and realizing new non-equilibrium phases in ongoing experiments will be developed.
The completion of this project will lead to a universal theoretical framework for non-equilibrium quantum dynamics, complementing statistical-mechanics in ergodic systems. Such a framework will enable engineering quantum-coherent many-body states with novel properties and functionalities.",Dmitry Abanin,University of Geneva,Switzerland,-,864597,ERC-2019-COG,Consolidator Grants,Physical sciences & engineering (PE),PE2 - Fundamental Constituents of Matter,2019,44136,46812,1850000,https://cordis.europa.eu/project/id/864597,University of Geneva
Horizon 2020,MONOLITH,Monolithic Multi-Junction Picosecond Avalanche Detector for future physics experiments and applications,"Particle-physics, space research and several other fields of basic and applied science necessitate the production of thin sensors capable to provide excellent position and time resolution at the same time.
The diode structure of present silicon pixel sensors strongly penalises the enormous potential of silicon-based time measurement: the ~30 ps intrinsic limit of diodes was already reached in sensors with internal gain with pad sizes of 1 mm2. Therefore, new ideas are needed to improve by another order of magnitude and reach the picosecond level.
This project introduces a novel silicon-sensor structure devised to overcome the intrinsic limits of present sensors and simultaneously provide picosecond timing and high spatial resolution in a monolithic implementation. This goal is achieved by the introduction of a fully depleted multi-junction. The remarkable performance of this new sensor, combined with the simplified assembly process and reduced production cost offered by the monolithic implementation in standard CMOS processes, represent the required breakthrough.
In addition to the novel multi-junction sensor, the cornerstones of the project are the low-noise very-fast SiGe HBT frontend and the patented TDC with robust synchronisation method that the PI has already produced in preliminary versions.
The monolithic detector proposed here will offer a sustainable solution for the next generation of experiments at hadron colliders, in nuclear physics and for space-borne experiments in cosmic-ray physics and solar physics. Besides the primary goal of basic science, it will represent an extraordinary enabling technology for the large spectrum of high-tech applications that benefits of picosecond-level Time-Of-Flight measurements. The innovative monolithic detector introduced here will also offer a starting point for further progress in the field of light detection.
European industrial partners have been contacted for commercial exploitation of the detector.",Giuseppe Iacobucci,University of Geneva,Switzerland,-,884447,ERC-2019-ADG,Advanced Grants,Physical sciences & engineering (PE),PE2 - Fundamental Constituents of Matter,2019,44013,45838,2500000,https://cordis.europa.eu/project/id/884447,University of Geneva
Horizon 2020,IONPEN,Trapped-ion quantum information in 2-dimensional Penning trap arrays,"This project will develop a new platform for quantum computation and quantum simulation based on scalable two-dimensional arrays of ions in micro-fabricated Penning traps. It builds upon the rapid advances demonstrating high precision quantum control in micro-fabricated radio-frequency ion traps while eliminating the most problematic element - the radio-frequency potential - using a uniform magnetic field. This offers a significant advantage: since the magnetic field is uniform it provides confinement at any position for which a suitable static quadrupole can be generated. By contrast, r.f. potentials only provide good working conditions along a line. This changed perspective provides access to dense two-dimensional strongly interacting ion lattices, with the possibility to re-configure these lattices in real time. By combining closely-spaced static two-dimensional ion arrays with standard laser control methods, the project will demonstrate previously inaccessible many-body interacting spin Hamiltonians at ion numbers which are out of the reach of classical computers, providing a scalable quantum simulator with the potential to provide new insights into the links between microscopic physics and emergent behavior. Through dynamic control of electrode voltages, reconfigurable two-dimensional arrays will be used to realize a scalable quantum computing architecture, which will be benchmarked through landmark experiments on measurement-based quantum computation and high error-threshold surface codes which are natural to this configuration. Realizing multi-dimensional connectivity between qubits is a major problem facing a number of leading quantum computing architectures including trapped ions. By solving this problem, the proposed project will pave the way to large-scale universal quantum computing with impacts from fundamental physics through to chemistry, materials science and cryptography.",Jonathan Home,Swiss Federal Institute of Technology Zurich (ETH Zurich),Switzerland,-,818195,ERC-2018-COG,Consolidator Grants,Physical sciences & engineering (PE),PE2 - Fundamental Constituents of Matter,2018,43556,45382,1999375,https://cordis.europa.eu/project/id/818195,ETH Zurich
Horizon 2020,Mu-MASS,Muonium Laser Spectroscopy,"Striking anomalies in the muon sector have accumulated in recent years: notably the famous anomalous muon magnetic moment (g-2) and the muonic hydrogen Lamb shift measurement which prompted the so-called proton charge radius puzzle. These tantalizing results triggered vibrant activity on both experimental and theoretical sides. Different explanations have been put forward including exciting solutions invoking New Physics beyond the Standard Model. To contribute to clarifying the origin of these anomalies, I propose Mu-MASS, an experiment aiming for a 1000-fold improvement in the determination of the 1S-2S transition frequency of Muonium (M), the positive-muon/electron bound state. This substantial improvement beyond the current state-of-the-art relies on the novel cryogenic M converters and confinement techniques developed by the PI, and on the new laser and detection schemes which the PI implemented for positronium spectroscopy. This experiment will be performed at the Paul Scherrer Institute (PSI). With the Mu-MASS result our knowledge of the muon mass can be improved by almost two orders of magnitude.  By using the expected results of the ongoing hyperfine splitting measurement of M in Japan, it will provide one of the most sensitive tests of bound-state Quantum Electrodynamics. It can also be used to extract the muon g-2 from the ongoing experiment at Fermilab. Since M is a unique system composed of two different leptons (point-like particles), the Mu-MASS results will provide the most stringent test of charge equality between the lepton generations. Moreover, it can be used to determine the Rydberg constant free from nuclear and finite-size effects and contribute to solving the proton charge radius puzzle. Mu-MASS is thus very timely and essential to the worldwide effort to understand the interesting observed discrepancies, which could be a hint of New Physics and therefore have profound implications on our understanding of the Universe.",Paolo Crivelli,Swiss Federal Institute of Technology Zurich (ETH Zurich),Switzerland,-,818053,ERC-2018-COG,Consolidator Grants,Physical sciences & engineering (PE),PE2 - Fundamental Constituents of Matter,2018,43497,45322,1999150,https://cordis.europa.eu/project/id/818053,ETH Zurich
Horizon 2020,FLAY,Flavor Anomalies and the origin of the Yukawa couplings,"Recent experimental results in flavor physics exhibit deviations from the Standard Model predictions that are growing with time, both as far as statistical significance and as far as internal consistency. Understanding the origin of this phenomenon, the so-called “flavor anomalies”, is of paramount importance for a deeper understanding of fundamental interactions. As recently shown by the PI and collaborators, this phenomenon is likely to be intimately related to the long-standing “flavor problem”, or the origin of the hierarchical pattern of quark and lepton mass matrices observed in Nature. The goal of this project is to shed light on both these issues, providing a solution to old and recent puzzles in flavor physics. We propose to address these questions via an original bottom-up approach, based on Effective Field Theory methods and simplified models, combined with new top-down ideas about the ultraviolet completion of the Standard Model. On the phenomenological side, the proposed bottom-up approach will allow us to exploit with the highest accuracy all the available and expected experimental data. It will allow us to take into account both low- and high-energy observables, as well as both quark and lepton sectors. These results will constitute the basis for the theoretical investigation of a new class of Standard Model extensions not considered so far. The latter are based on new ideas, such as flavor non-universal gauge interactions, that imply a change of paradigm in theoretical high-energy physics: the origin of the flavor hierarchies plays a central role in revealing the ultraviolet completion of the Standard Model. Combining a bottom-up approach to flavor-physics data with top-down ideas on the origin of the flavor hierarchies, this project has the potential to lead to a major advancement in fundamental physics.",Gino Isidori,University of Zurich,Switzerland,-,833280,ERC-2018-ADG,Advanced Grants,Physical sciences & engineering (PE),PE2 - Fundamental Constituents of Matter,2018,43709,45535,2318750,https://cordis.europa.eu/project/id/833280,University of Zurich
Horizon 2020,MajorNet,Majorana neutrino discovery strategy with CMS,"The Large Hadron Collider at CERN is successfully operating at a record-breaking energy and is expected to deliver an enormous dataset of 300/fb of proton-proton collisions in the next 6 years. I propose to take advantage of both the unprecedented collision energy and the large number of events to be recorded in order to search for signs of new particles which could uncover the nature of dark matter, provide an explanation for the matter-antimatter asymmetry of the universe or answer questions about the origin of neutrino masses. To achieve this, I will build on my expertise devising and organizing new physics searches with leptons and will establish and lead a new multi-signature research programme at the CMS experiment. This programme will exploit both the intensity and energy frontiers opening up at the LHC and can be further expanded at the high-luminosity LHC (HL-LHC). Since the masses and couplings of the new particles are unconstrained, my proposed search strategy will be such that a wide mass range will be covered also encompassing many orders of magnitude in the coupling strength.",Lesya Shchutska,Swiss Federal Institute of Technology Lausanne (EPFL),Switzerland,-,758316,ERC-2017-STG,Starting Grants,Physical sciences & engineering (PE),PE2 - Fundamental Constituents of Matter,2017,43101,45412,1500000,https://cordis.europa.eu/project/id/758316,EPF Lausanne
Horizon 2020,mPP,machine learning for Particle Physics,"This project proposes to use modern Machine Learning (ML),  particularly Deep Learning (DL), as a breakthrough solution to address the scientific, technological, and financial challenges that High Energy Physics (HEP) will face in the decade ahead. The quest for new physics is increasing the complexity of the experiments and, consequently, the human and financial costs to operate these detectors, with experiments facing at best flat budgets. ML offers a way out of this impasse. With the development of DL, ML has successfully addressed tasks such as image recognition and text understanding, which eventually opened the way to automatizing complex tasks. These progresses have the potential to revolutionize HEP experimental techniques. We propose to apply cutting-edge ML technologies to HEP problems, paving the way to self-operating detectors, capable of visually inspecting events and identifying the physics process generating them, while monitoring the goodness of the data, the correct functioning of the detector components and, if any, the occurrence of anomalous events caused by unspecified new physics processes. We structure the work in a set of working packages, representing intermediate steps towards this final goal. We propose to apply ML to data taking, event identification, data-taking monitoring, and event reconstruction as intermediate steps toward using these techniques for unsupervised physics searches. The project resources will by used to create a team of computer scientists, who will carry on a systematic R&D program to apply  cutting-edge ML technology to HEP: reinforced learning, generative models, event indexing, data mining, anomaly and outliers detection, etc. Being hosted at CERN, the project will benefit from existing computing infrastructures, large datasets availability, the presence of local experts of each aspect of HEP, and established collaborations with private companies on hardware and software R&D.",Maurizio Pierini,European Organization for Nuclear Research (CERN),Switzerland,-,772369,ERC-2017-COG,Consolidator Grants,Physical sciences & engineering (PE),PE2 - Fundamental Constituents of Matter,2017,43191,45107,1703750,https://cordis.europa.eu/project/id/772369,European Organization for Nuclear Research (CERN)
