programme,acronym,project_title,abstract,researcher,host_institution,country,region,project_number,call,instrument,research_domain,panel,call_year,start_date,end_date,amount_granted,cordis_link,snsf_institution
Horizon 2020,MADEFUN,Regulation of Brain Macrophage Development and Function,"Macrophages are part of the mononuclear phagocyte system and play critical roles in innate immune responses. They further exert crucial organ-specific functions to warrant tissue homeostasis. Most macrophages are long-lived and derive from embryonic precursors. The central nervous system (CNS) contains several macrophage populations, of which microglia are the most prominent and abundant population residing in the CNS parenchyma. Besides being implicated in CNS pathologies, microglia guide neuronal development, are critical for neurogenesis and contribute to the maintenance of tissue homeostasis. At the interface between the brain and the periphery reside choroid plexus, perivascular and meningeal macrophages (‘border-associated’ macrophages, BAMs). While they mostly also originate from embryonic precursors, the differentiation cues and their specific roles in development and in health and disease are poorly understood. Here we will delineate the spatiotemporal emergence of BAMs and microglia, the impact of the local microenvironment on their phenotype and function, and their role in brain development. We will further analyze the role of BAMs and microglia in physiological and neuropathological conditions (neurodegeneration, CNS infection and inflammation). We have recently described a novel ‘microglia-specific’ conditional mouse and we are currently establishing an inducible system to specifically manipulate BAMs. We will use these to genetically intervene in different cytokine signaling pathways in combination with fate-mapping in vivo. The proposed research project will provide a deeper insight into microglia and BAM biology and their functional specializations at different stages of life.",Melanie Greter,University of Zurich,Switzerland,-,819229,ERC-2018-COG,Consolidator Grants,Life Sciences (LS),"LS6 - Immunity, Infection & Immunotherapy",2018,43617,45808,1995500,https://cordis.europa.eu/project/id/819229,University of Zurich
Horizon 2020,InflamCellDeath,"Mechanism and function of gasdermin-induced inflammatory cell death
","Pyroptosis is a lytic pro-inflammatory type of programmed cell death that is induced by inflammatory caspases, a family of proteases that control the innate immune response to infection, injury or noxious substances. Inflammatory caspases are activated within so-called inflammasomes, cytosolic signalling platforms that are assembled by pattern recognition receptors upon the detection of pathogen- or host-derived danger signals. Pyroptosis is essential for antimicrobial host defense, but also promotes the concomitant release of inflammatory danger signals and leaderless cytokines that is detrimental during chronic inflammatory disease.Recently it was found that pyroptosis is caused by the cleavage of a single caspase substrate called gasdermin-D. This cleavage generates a cytotoxic N-terminal fragment of gasdermin-D that targets the plasma membrane, where it forms large permeability pores and thus causes pyroptotic cell death. Gasdermin-D is only one member of the larger gasdermin protein family, an emerging group of cell death effectors that share its pore-forming cytotoxic activity and that appear to be major regulators of inflammatory necrotic cell death.The main goal of this proposal is to comprehensively characterize the function of gasdermins in anti-microbial host defense, to investigate the consequences of gasdermin-D pore formation to the host cell and to elucidate the pathways that regulate gasdermin activation. My objectives are:1) to define the role of gasdermin-D in inflammasome-dependent anti-bacterial host defense2) to study the role of membrane repair in restricting gasdermin-D-induced membrane3) to characterize the function and regulation of other gasdermin family members during infectionBy characterizing the mechanism and function of gasdermin-induced cell death in host-defense and inflammation this project may contribute to the development of novel therapies for infectious as well as inflammatory diseases.",Petr Broz,University of Lausanne,Switzerland,-,770988,ERC-2017-COG,Consolidator Grants,Life Sciences (LS),"LS6 - Immunity, Infection & Immunotherapy",2017,43160,45351,1999176,https://cordis.europa.eu/project/id/770988,University of Lausanne
Horizon 2020,PneumoCaTChER,The role of cell-to-cell variability in pneumococcal virulence and antibiotic resistance,"Within clonal bacterial populations not all cells exhibit the same phenotype, even though they grow in the same environment. The molecular sources contributing to phenotypic variation are diverse and can originate from noise in gene expression to heterogeneity in growth rates or cell cycle state. Phenotypic variation helps pathogenic bacteria to elude the host immune response or resist antibiotic pressure. Vice versa, there is cell-to-cell variability in the host’s response towards pathogens that can be exploited by bacteria. How the combined cellular heterogeneity of both host and microbe contribute to infection outcome is poorly understood. The role of phenotypic variation on antibiotic resistance development is also unclear.Recently, we developed novel single cell imaging systems as well as genetic engineering and screening platforms for application to the important opportunistic human pathogen Streptococcus pneumoniae. In addition, we generated a dual-transcriptomics overview of pneumococcal infection of human lung epithelial cells and setup collaborations to perform several infection models. This now places us in an excellent position to investigate the mechanisms and the importance of single cell behaviour for pneumococcal virulence and antibiotic resistance.The driving hypothesis of this application is that the combined heterogeneity of host cells and pneumococci influences infection and antibiotic therapy outcome. To test this, we will use innovative approaches for infection biology by combining synthetic biology and quantitative single cell biology including single cell RNA-seq, CRISPRi, engineered bistable switches and microfluidics. We will reveal the molecular mechanisms underlying cell-to-cell variability and its importance in virulence and antibiotic resistance. Insights obtained in this project will lead to a better understanding of phenotypic variation and might result in new treatment strategies for pneumococcal infections.",Jan-Willem Veening,University of Lausanne,Switzerland,-,771534,ERC-2017-COG,Consolidator Grants,Life Sciences (LS),"LS6 - Immunity, Infection & Immunotherapy",2017,43405,45230,1999735,https://cordis.europa.eu/project/id/771534,University of Lausanne
Horizon 2020,PhotoPHARMA,Light-induced synthesis of protein-drug conjugates for imaging and therapy,"The ability to functionalise a biologically active protein with a range of different cargo molecules is crucial to accessing new tools for use in fundamental science and clinical medicine. For instance, antibody-conjugates that graft reporter molecules including fluorescent tags or radioactive metal ion chelates play vital roles in diagnostic imaging with optical and nuclear medicine techniques like positron emission tomography (PET). State-of-the-art advances in chemotherapy also take advantage of the biophysical properties of antibodies in the design of highly potent antibody-drug conjugates (ADCs) that facilitate specific delivery and uptake of cytotoxic or radiotoxic payloads to disease lesions. Surprisingly, almost all existing methods to produce protein-conjugates rely on thermally-mediated coupling chemistries. In PhotoPHARMA, the goal is to break away from the convention of using heat to drive protein functionalisation by designing new photochemical reagents that are activated by the absorption of light. Light-induced activation has the potential to solve many of the practical issues encountered in the synthesis of radiolabelled antibodies and other protein-conjugates. The work encompasses 4 main Objectives:  Objective 1. Explore the biochemical scope of light-induced reactions for bimolecular protein-ligation  Objective 2. Synthesis, characterisation and biological studies of photo(radio)labelled antibodies for use in diagnostic imaging and therapy  Objective 3. Develop automated technologies for photoradiochemical synthesis of 89Zr-antibodies  Objective 4. Establish the GLP-synthesis and Chemistry, Manufacturing and Controls (CMC) for future translation of photoradiolabelled 89Zr-antibodies to the clinic  The long-term goals are to facilitate the synthesis and clinical translation of protein-drug conjugates by introducing a radical new technology based on the fast, reliable and automated approach of using light-induced chemistry.",Jason Holland,University of Zurich,Switzerland,-,101001734,ERC-2020-COG,Consolidator Grants,Life Sciences (LS),"LS7 - Prevention, Diagnosis & Treatment of Human Diseases",2020,44593,46418,2000000,https://cordis.europa.eu/project/id/101001734,University of Zurich
Horizon 2020,DRUGSBUGS,"Improved therapies for soil-transmitted helminthiases: exploring pharmacomicrobiomics, novel drugs and microfluidic assay platforms","An estimated 1.5 billion people are infected with soil-transmitted helminths (STHs) causing a global burden of 1.9 million disability-adjusted life years (DALYs). Current treatment options are limited. Preliminary studies in my lab hint towards a gut microbiome mechanism responsible for treatment failures of the most efficacious treatment currently available, albendazole-ivermectin. I propose an innovative 5-year project (“DRUGSBUGS”) that holds promise for major breakthroughs in anthelminthic drug discovery and development. I will deepen the understanding of current and potentially upcoming anthelminthics, in particular the microbiome-driven modulation of anthelminthic treatment. I will investigate underlying gut microbial structures in human stool samples associated with efficacy of albendazole-ivermectin treatment. Findings will be experimentally validated in vitro and in vivo. In addition, I speculate that emodepside will emerge as a novel key player in the anthelminthic drug armamentarium, which will enhance efficacy and reduce the risk of selection of resistant helminth populations. DRUGSBUGS proposes two Phase 2a dose selection trials with emodepside against Trichuris trichiura and hookworm in adults. Subsequent Phase 2b studies will assess whether emodepside is superior to albendazole against hookworm and T. trichiura. Using a microsampling technique, I will characterize the pharmacokinetics of emodepside in patients infected with T. trichiura and hookworm. In parallel, investing in innovative new technologies in the field of drug discovery will facilitate the discovery and development of the next generation of anthelminthics. I propose to study drug effects on motility and viability of different STH larvae applying electrical impedance spectroscopy on a microfluidic chip platform. My proposed research is of considerable public health relevance since it will ultimately result in improved treatments for soil-transmitted helminthiases.",Jennifer Keiser,Swiss Tropical and Public Health Institute,Switzerland,-,101019223,ERC-2020-ADG,Advanced Grants,Life Sciences (LS),"LS7 - Prevention, Diagnosis & Treatment of Human Diseases",2020,44562,46387,2470621,https://cordis.europa.eu/project/id/101019223,Schweizerisches Tropen- und Public Health-Institut
Horizon 2020,EPOCHAL,Beyond seasonal suffering: Effects of Pollen on Cardiorespiratory Health and Allergies,"As climate change increases the duration and intensity of the pollen season, allergies to airborne pollen are increasingly common in Europe. Yet, it is not well recognized that high pollen concentrations may increase respiratory and cardiovascular events, leading to mortality and excess hospitalizations. I aim to investigate how short-term exposure to pollen is related to mortality, hospitalization and allergic symptoms, both on its own and synergistically with air pollution and weather.
I will develop spatiotemporal exposure models of pollen for the years 2003-2022 based on a network of 14 pollen measurements stations in Switzerland. Taking advantage of large, real-world datasets without selection bias (Swiss National Cohort) and the efficient case-crossover study design, I will investigate the population effects of pollen on daily respiratory and cardiovascular mortality and hospitalization, also accounting for variation in air pollution and weather conditions. To explore individual sensitivity, I will conduct repeated measurements of lung function and airway inflammation in a dedicated panel of 400 allergic patients complemented with opportunistic repeated accounts of self-reported symptoms from the “e-symptoms” app by Swiss Allergy Centre. To provide personalized prevention recommendations and enhance quality of life for the allergic population, I will derive exposure-response relationships based on prevalent pollen, air pollution and weather triggers and individual symptom reports, allowing me to ultimately forecast symptom severity using machine learning techniques.
This highly innovative project utilizes available nationwide health datasets and systematic novel data collection methods (in the in-depth panel study), to better understand the role of pollen in respiratory and cardiovascular diseases at both personalized and population levels. The project will prevent and reduce health effects due to pollen, which constitute a large burden on health and economy.",Marloes Eeftens,Swiss Tropical and Public Health Institute,Switzerland,-,853568,ERC-2019-STG,Starting Grants,Life Sciences (LS),"LS7 - Prevention, Diagnosis & Treatment of Human Diseases",2019,44044,45869,1381931.5,https://cordis.europa.eu/project/id/853568,Schweizerisches Tropen- und Public Health-Institut
Horizon 2020,TAVI4Life,A lifelong transcatheter aortic valve prosthesis,"Transcatheter aortic valve implantation (TAVI) techniques have revolutionized the therapy options for valvular heart disease. Initially developed for elderly high-risk patients, TAVI is being extended to younger patients and may become a first-line treatment in the near future. 
However, the available bioprostheses for TAVI are prone to degeneration, and patients may thus require multiple re-interventions, significantly affecting their life quality. To date, a native-analogous TAVI prosthesis with in-situ remodeling capacity does not exist. Tissue engineered (TE) heart valves represent a potential solution, but are not yet suitable for high-pressure applications and lack clinical translation because of uncontrolled in-vivo remodeling, impairing their long-term functionality.
In the TAVI4Life project, I aim to develop and validate a novel TAVI prosthesis for young patients with the unique ability to transform into a fully autologous valve within the body and last for life. This project will go far beyond previous TE concepts by engineering a novel decellularized human ECM and a bioresorbable stent and applying an unconventional bioengineering approach combining in-vitro, in-silico, and in-vivo TE methods. First, I will engineer and characterize a clinical-grade ECM for high-pressure conditions and test patient-specific immuno- and hemocompatibility profile (in-vitro). Next, using computational modeling, I will design and develop a bioresorbable stent and implement an analytical valve design to develop the transcatheter prosthesis (in-silico). Finally, I will evaluate valve performance and remodeling in a preclinical large animal model (in-vivo). This highly multidisciplinary approach will lead to a valve prosthesis that lasts for life, as guided in-situ tissue remodeling will enable their long-term performance. The clinical impact will be enormous as, particularly for young patients, the TAVI4Life will significantly enhance their life expectancy and quality of life.",Maximilian Y. Emmert,University of Zurich,Switzerland,-,852814,ERC-2019-STG,Starting Grants,Life Sciences (LS),"LS7 - Prevention, Diagnosis & Treatment of Human Diseases",2019,44105,46112,1499375,https://cordis.europa.eu/project/id/852814,University of Zurich
Horizon 2020,IBAF,Inhibiting BAF to Improve Gene Delivery,"Safe and efficient delivery of nucleic acids to tissues and cells is a shared challenge in the clinical translation of gene therapy and gene editing. At the intracellular level, DNA delivery is hindered by endo/lysosomal sequestration, inefficient transport into the nucleus and a retention mechanism mediated by the barrier-to-autointegration factor (BAF) protein that detects, clusters and locks away intruding double-stranded DNA in membrane cages. The first two of these intracellular obstacles are well-known bottlenecks and are being addressed by many laboratories. However, preliminary in vitro data suggest the detrimental impact of BAF’s mechanism on transgene expression is underestimated. We hypothesize that transiently suppressing BAF or one of its regulating factors will increase the cytosolic availability and mobility of transfected DNA, facilitating its transport to the nucleus and ultimately boosting transfection efficiency. We will tackle this rather uninvestigated mechanism through two parallel strategies: i) identifying novel small-molecule inhibitors of BAF or its regulators via high-throughput screening of chemical libraries, and ii) producing a recombinant kinase that phosphorylates BAF in situ and thus supresses its DNA-clustering function. The BAF suppressors will be co-delivered to cells with rationally-designed nucleoprotein nanoparticles consisting of a reporter plasmid and a dual-function fusion protein to facilitate endocytosis and endosomal escape. The combined transfection-enhancing effect of the BAF suppressors and the nanoparticles will be extensively characterized in vitro, and in vivo proof-of-concept will be obtained in mice. Besides expanding our fundamental knowledge on this unexplored DNA retention mechanism, the project will provide powerful transfection enhancers that can boost already-existing gene delivery platforms (viral and non-viral), so that these can reach their full potential for gene therapy and gene-editing applications.",Jean-Christophe Leroux,Swiss Federal Institute of Technology Zurich (ETH Zurich),Switzerland,-,884505,ERC-2019-ADG,Advanced Grants,Life Sciences (LS),"LS7 - Prevention, Diagnosis & Treatment of Human Diseases",2019,44136,45961,2390625,https://cordis.europa.eu/project/id/884505,ETH Zurich
Horizon 2020,IMPACT,High-Dimensional single cell mapping of inflammatory disease signatures in monozygotic twins,"Multiple Sclerosis (MS) is a chronic inflammatory disease, where immune cell invasion into the central nervous system causes immunopathology and neurological deficit. Although disease-modifying therapies dramatically reduce disease activity, they hold the potential for severe adverse effects while long-term disability prospects remain poor. Moreover, there is to date no biomarker for monitoring the disease activity and to guide therapy decisions. I propose that the key to identifying such biomarkers is to combine single-cell mapping of leukocytes across well-curated patient cohorts with unbiased machine-learning based data interrogation. Using such an approach, we have already delineated a disease signature in a helper T cell population specific for MS. However, the immune compartment of cross-sectional cohorts is influenced by the individual genetic make up, which masks disease-specific signals and hinders a more precise characterisation of involved immune cell populations. To eliminate genetic influences, I here propose in aim 1 to interrogate the immune compartment of a unique cohort of monozygotic twin pairs -discordant for MS- and deeply analyse peripheral blood lymphocytes by single-cell mass cytometry, combined TcR and single cell sequencing, and epigenetic profiling.  aim 2 to develop representation-learning methods to account for the paired genetics of twins or longitudinal samples and to include clinical covariates into the high-dimensional data set. aim 3 to use well-defined patient samples of MS-like disorders (MS-Mimics) and longitudinal samples of patients undergoing disease-modifying therapy (e.g. B cell depletion, autologous stem cell transplant) using single-cell mass cytometry. Ultimately, the goal is to reduce the dimensionality of disease signature(s) towards a clinically translatable low-dimensional biomarker that could be identified and quantified by routine methods available in the clinics.",Burkhard Becher,University of Zurich,Switzerland,-,882424,ERC-2019-ADG,Advanced Grants,Life Sciences (LS),"LS7 - Prevention, Diagnosis & Treatment of Human Diseases",2019,44197,46387,2492221,https://cordis.europa.eu/project/id/882424,University of Zurich
Horizon 2020,TETHER,Targeting the essentialome of radiotherapy-resistant cancer,"More than 50% of the cancer patients undergo irradiation as part of their cancer treatment. Although radiotherapy (RT) significantly contributes to cancer cure, local therapy resistance and the subsequent emergence of distant metastasis remain major obstacles for its success. The molecular mechanisms underlying tumor cell-intrinsic RT resistance are ill-defined. It is therefore crucial to better define these mechanisms and identify new vulnerabilities of RT-resistant tumors in order to decrease the current annual cancer mortality of >1.3 million persons in EU member states alone.

In the TETHER project, I will address the problem of RT resistance by synergizing the power of genetic essentiality analyses with unique mouse models and organoids that we have established. We recently found that members of the shieldin and CST complexes are essential for tumor cells to survive irradiation, while causing PARP inhibitor resistance when lost in BRCA1-deficient tumors. Based on this unexpected finding, I have started a new line of research to dissect the RT ""essentialome"". As I show with the discovery and functional characterization of ERCC6l2 as a novel DNA repair factor in this network, the technology we have in place is perfectly suited to tackle this question. In addition, we will apply distinct CRISPR/Cas9-based tests to map the functional interactome of genes that are essential for RT resistance. 

To follow the plasticity and RT escape of tumor cells in vivo, we have also developed innovative model systems. Similar to the situation in cancer patients, we observe that residual cancer cells in our mouse models escape the deadly effects of RT by local resistance or metastasis formation. Thus, these models provide a unique opportunity to explore and target RT escape mechanisms. I am convinced that the combination of these state-of-the-art approaches will yield highly useful information for designing individualized approaches to improve RT response in cancer patients.
",Sven Rottenberg,University of Bern,Switzerland,-,883877,ERC-2019-ADG,Advanced Grants,Life Sciences (LS),"LS7 - Prevention, Diagnosis & Treatment of Human Diseases",2019,44470,46295,2499875,https://cordis.europa.eu/project/id/883877,University of Berne
Horizon 2020,TIL-FIT,Increasing the fitness of tumor-infiltrating T cells for cellular immunotherapy,"Adoptive T cell therapies (ACTs) are emerging as a promising strategy to treat cancer. Tumor-infiltrating lymphocytes (TILs) are expanded ex vivo, selected for recognition of neoantigens, further expanded and then infused back into patients. This procedure requires extensive culturing and expansion of TILs during which many T cell clonotypes are lost. As tumor-reactive TILs are often exhausted and tend to be overgrown by functional, non-specific T cells in culture, the chance to identify potent tumor-reactive T cells dramatically decreases. Moreover, extensive expansion of T cells diminishes their anti-tumor activity and persistence in the body after adoptive transfers. Thus, improving the fitness of T cells is crucial to increase the success rate of ACTs and make this therapy accessible to a broad spectrum of cancer patients. Our first aim is to increase the fitness of T cells by designing metabolic and pharmacological interventions based on proteomic profiles of TILs from patients with liver cancer. Second, we will use machine-learning algorithms for the extraction of signatures to predict whether TILs grow well in culture, require and respond to metabolic interventions, or cannot be revitalized and do not grow at all. To deal with non-growing T cells, we aim at establishing a microfluidics-based workflow to graft the entire T cell receptor (TCR) repertoire from thousands of non-growing TILs onto fast growing Jurkat cells. After selecting Jurkat cells that recognize neoantigens, their TCRs will be expressed on naïve T cells obtained from the patient’s blood that are fit and suitable for ACT. This project will contribute to a better understanding of the T cell response to liver cancer and help increasing the success of personalized ACTs for solid tumors.",Roger Geiger,Institute for Research in Biomedicine,Switzerland,-,803150,ERC-2018-STG,Starting Grants,Life Sciences (LS),"LS7 - Prevention, Diagnosis & Treatment of Human Diseases",2018,43466,45291,1406250,https://cordis.europa.eu/project/id/803150,Institute for Research in Biomedicine
