programme,acronym,project_title,abstract,researcher,host_institution,country,region,project_number,call,instrument,research_domain,panel,call_year,start_date,end_date,amount_granted,cordis_link,snsf_institution
Horizon 2020,EMPOWER,Medium Voltage Direct Current Electronic Transformer,"More than a century ago, the invention of alternating current (AC) transformer has made AC the preferred choice over the direct current (DC) technologies. Line AC transformers are bulky but simple and reliable devices, made out of copper and iron, providing voltage adaptation and galvanic isolation in AC power systems. Currently, DC technology is increasing its presence in AC power systems, enabled by progress in semiconductor devices and power electronics based energy conversion. DC power distribution networks can effectively support energy transformation and high penetration of distributed energy resources and energy storage integration (both increasingly being DC by nature) in future energy systems. Despite this shift towards the DC power distribution networks, DC Transformer, offering AC transformer like features (and beyond) does not exist, either conceptually or practically.To enable the next (r)evolution in power systems, the EMPOWER project will develop the DC Transformer, a novel, flexible, highly efficient, compact, and reliable conversion principle for seamless energy routing in high-power DC distribution networks. Through a holistic approach, novel concepts, integration and optimization, we will demonstrate new design paradigms for galvanically-isolated power conversion. Our approach relies on resonant conversion utilizing high-voltage semiconductor devices in combination with high-frequency magnetic materials. We propose a new approach for the DC Transformer, avoiding active power flow control and instead utilizing control effort for the safety and protection. The DC Transformer will unify functions of a power converter and a protection device into a single power electronics system, improving drastically the conversion efficiency, reliability and power density in future DC power distribution networks. The success of this project will place Europe at the edge of reliable, efficient and safe energy distribution and transmission technologies.",Drazen Dujic,Swiss Federal Institute of Technology Lausanne (EPFL),Switzerland,-,818706,ERC-2018-COG,Consolidator Grants,Physical sciences & engineering (PE),PE7 - Systems & Communication Engineering,2018,43617,45443,2198145,https://cordis.europa.eu/project/id/818706,EPF Lausanne
Horizon 2020,FeelAgain,Restoring natural feelings from missing or damaged peripheral nervous system by model-driven neuroprosthesis,"Due to sensory loss diabetic patients are prone to falls and to foot ulcers, which consequently increase the risk of amputations. Because of the lack of sensory feedback amputees experience falls, perceive the prosthesis as a foreign body and therefore do not rely on it during walking. This causes counterbalancing movements that increase fatigue. Both types of patients suffer neuropathic pain, associable to aberrant sensory inputs. Neural pathways between the periphery and the brain are still functional above the damage or the amputation. Targeting these structures with peripheral neural interfaces could allow the restoration of natural sensory functionalities. The aim of project is to develop the first neuroprosthesis restoring natural foot sensations, through sciatic nerve stimulation, to patients with diabetic neuropathy or leg amputation. To that aim we will develop a detailed computational model of the sensory loop of the sciatic nerve. It will merge the electrical stimulation effects on sensory fibers and transduction of mechanical deformations of the skin into action potentials. Modelling results will be validated through animal experiments involving the stimulation of sciatic nerve, and simultaneous recordings from the dorsal root ganglion. Applying this modeling framework we will optimize the geometry of a peripheral neural interface, its surgical placement and define stimulation protocols that mimic natural sensory feedback responses. Effective device for feedback restoration will be constructed, able to translate the signals recorded by sensorized sole placed under the prosthetic or diabetic foot into the natural foot sensations perceived by subject. The interventional tools for embodiment boosting and pain relief will be developed. Clinical tests on amputee and diabetic subjects will assess the efficacy of the FeelAgain conceptual and technological framework by examination of pain, embodiment, ulcer prevention, falls avoidance and walking ability.",Stanisa Raspopovic,Swiss Federal Institute of Technology Zurich (ETH Zurich),Switzerland,-,759998,ERC-2017-STG,Starting Grants,Physical sciences & engineering (PE),PE7 - Systems & Communication Engineering,2017,43191,45382,1499637,https://cordis.europa.eu/project/id/759998,ETH Zurich
Horizon 2020,PISSARRO,Photonic integrated devices for second order nonlinear optical processes,"Second order nonlinear processes, such as second-harmonic or difference-frequency generation, are key for frequency metrology and quantum optics applications. The successful integration of such functionalities, consequential of material 2nd order nonlinear susceptibility χ(2),  is essential to obtain compact and low power devices. Unfortunately embedding 2nd order nonlinear effects on chip poses a fundamental challenge captured by the following dogma: materials with the best photonic integration capabilities exhibit negligible χ(2). Recent research by the PI proves this dogma flawed and shows that 2nd order nonlinearities can be unlocked in silicon nitride (SiN) waveguides by all-optical means, a result that is a significant departure from other existing approaches. PISSARRO will develop waveguides for χ(2) based effects and confront the limitations imposed by fabrication, resonant structures, or phase-matching constraints, thus seeking optimal trade-offs. By leveraging the linear properties and fabrication flexibility of SiN waveguides, the synergy between optically induced electric field from multi-photon absorption, large material 3rd order nonlinearity  and waveguide engineering will be exploited, to overcome the initial low efficiency. The objectives are far beyond the state-of-the-art by providing all-optical control, flexibility and extended operation bandwidth. The project will build on the in-depth optical characterization of the microscopic nature of optically-induced 2nd order nonlinearity in SiN to take integrated 2nd order nonlinear devices to new frontiers. PISSARRO promises substantial impact in the domains of communication, metrology and quantum optics by providing novel CMOS-compatible photonic devices. Designed waveguides will not only lead to the integration of stabilized octave spanning combs for precise frequency references, but also introduce a path towards dynamic on-chip quantum state generation and unconstrained frequency conversion.",Camille Sophie Bres Ep. Tremblay,Swiss Federal Institute of Technology Lausanne (EPFL),Switzerland,-,771647,ERC-2017-COG,Consolidator Grants,Physical sciences & engineering (PE),PE7 - Systems & Communication Engineering,2017,43282,45291,1999400,https://cordis.europa.eu/project/id/771647,EPF Lausanne
Horizon 2020,OCAL,Optimal Control at Large,"Despite wide ranging progress on both the theory and applications of optimal control for more than half a century, considerable challenges remain when it comes to applying the resulting methods to large scale systems. The difficulties become even greater when one moves outside the classical realm of model based optimal control to address problems where models are replaced by data, or macroscopic behaviours emerge out of microscopic interactions of large populations of agents. To address these challenges, we propose here to develop a framework for approximating optimal control problems using randomised optimisation. The starting point will be formulations of optimal control problems as infinite dimensional linear programs. Our recent work suggests that randomised methods on the one hand can serve as a basis for algorithms to approximate such infinite programs and on the other enjoy close connections to statistical learning theory, providing a direct link to data driven approaches. Turning these intuitions into an approximation framework for optimal control that rests on solid theoretical foundations and provides explicit accuracy guarantees will be the methodological contribution of the proposed research. The resulting methods can find a range of applications in engineering and beyond; here we will investigate two such applications. One is motivated by our work on energy management in buildings and districts. The challenge here is the dimensionality of the system, especially if one would like to include weather and other forecast information and the corresponding uncertainty. The second application will be to so-called population systems, that involve the interaction of many agents with local decision-making capabilities coupled through the use of common resources. Here the main challenges are defining suitable ""features"" to abstract the individual states and the integration of uncertainty due to the presence of non-participating agents.",Ioannis Lygeros,Swiss Federal Institute of Technology Zurich (ETH Zurich),Switzerland,-,787845,ERC-2017-ADG,Advanced Grants,Physical sciences & engineering (PE),PE7 - Systems & Communication Engineering,2017,43405,45596,2497058,https://cordis.europa.eu/project/id/787845,ETH Zurich
Horizon 2020,ONE-MIX,Mid-infrared optical dual-comb generation and spectroscopy with one unstabilized semiconductor laser,"ONE-MIX proposes to develop single-source dual-comb lasers for mid-infrared (2-5 μm wavelength)spectroscopy, potentially enabling many new applications in science and industry, such as environment, safety,pharma, and health. This proposal extends our recent demonstration of a dual-comb MIXSEL (ModelockedIntegrated eXternal-cavity Surface Emitting Lasers) in the near-infrared, validated by measuring weak waterabsorption at 968 nm. Many more relevant gas absorption lines, however, are in the mid-infrared, wheresensitivities of parts-per-billion can be achieved.Dual-comb mid-IR spectroscopy applications are currently limited by the cost, complexity, and size ofconventional optical comb systems, based on two modelocked lasers with four active stabilization loops. Thesingle-source dual-comb MIXSEL, however, substantially reduces the complexity of existing systems to asingle compact free-running laser. In comparison to other competing new approaches such as quantum cascadelasers or micro resonator combs, the MIXSEL provides substantially more power per comb line with lowlinewidth and noise, and is ideally suited for a 1 to 5 GHz comb spacing, which is optimal for many molecularspectroscopy applications, allowing for fast, accurate, and sensitive absorption measurements.This proposal leverages our know-how in MIXSEL design combined with III-V semiconductor epitaxy todemonstrate this new class of lasers in the mid-IR, enabling simpler, lower-cost systems with sufficient speedand sensitivity for many relevant and commercially interesting applications in the 2 to 5 μm spectral region,such as CO2 , CH4, or NOx trace gas detection. We propose to extend the near-IR MIXSELs to the mid-IR bycombining two validated semiconductor approaches – using type-II gain quantum wells combined with a type-I saturable absorber quantum wells, fabricated with existing GaSb (gallium-antimonide) molecular beamepitaxy systems operated out of the FIRST lab at ETH Zurich.",Ursula Keller,Swiss Federal Institute of Technology Zurich (ETH Zurich),Switzerland,-,787097,ERC-2017-ADG,Advanced Grants,Physical sciences & engineering (PE),PE7 - Systems & Communication Engineering,2017,43466,45596,3210000,https://cordis.europa.eu/project/id/787097,ETH Zurich
Horizon 2020,TRANS,Synthesis of novel stimuli responsive dielectric polymers and their use in powerful transducers,"This ERC CoG will serve to build a strong multidisciplinary group concentrating on the synthesis of novel functional dielectric polymers that are printed into devices capable of converting one form of energy into another. Research spans all the way from materials’ synthesis and optimization, via device engineering to exploration of the manifold applications. TRANS will develop novel high dielectric permittivity elastomers and piezoelectric elastomers with an unprecedented collection of properties and use them as active components in devices for emerging technologies. The devices are not only of high technological and scientific importance, but also exhibit substantial economic and societal impact. They will reversibly change their shape in response to an electric field, generate electricity when mechanically stretched, cool while using little energy, convert thermal energy directly into electricity and, finally, store electricity in the form of batteries. The polymers developed in TRANS will combine either unprecedentedly high dielectric permittivity with a high dielectric breakdown field or piezoelectric properties with high elasticity. They have the potential to revolutionize different fields of applications such as actuators, sensors, energy harvesting, artificial muscles, soft robotics, energy storage, stretchable electronics, and solid-state refrigeration. A particularly important aspect concerns the synthesis of scalable and environmentally friendly, easy-to-apply and process printable inks, which are the active ingredients of various devices. After project termination, the applicant’s group will expand the fundamental understanding of structure-dielectric properties relationship and will be able to provide inks that are printed in prototype devices responsive to electricity, heat or mechanical stress.",Dorina Maria Opris,Swiss Federal Laboratories for Materials Science and Technology (Empa),Switzerland,-,101001182,ERC-2020-COG,Consolidator Grants,Physical sciences & engineering (PE),PE8 - Products & Processes Engineering,2020,44317,46142,1999715,https://cordis.europa.eu/project/id/101001182,Swiss Federal Laboratories for Materials Science and Technology
Horizon 2020,CQWLED,Overcoming the efficiency limitation of semiconductor quantum dot-based light-emitting diodes,"The colloidal quantum dots (CQDs) are an emerging are an emerging class of light-emitting compounds for solution-processed optoelectronics such as the light-emitting diodes (LEDs). Compared to the state-of-the-art compound semiconductors and organic light emitting diodes (OLED), the CQD-based LEDs possess extremely high color purity and low materials cost, representing the only feasible materials solution towards realization of the newly-defined Rec. 2020 standard for the next-generation displays. However, the theoretical upper limit of the device external quantum efficiency (EQE) is only ~20%, considerably lower than those in OLEDs and InGaN LEDs. The fundamental bottleneck is that it is not yet possible to control the emission directionality perpendicular to the substrate plane in the CQD superlattices, without compromising the photoluminescence quantum yield (PLQY). As a result, a lot of photons are wasted due to the total internal reflection (TIR) at the air/glass interface, as well as exciton quenching during interparticle energy transfer.
In order to overcome the efficiency limitation, my research group pioneers synthesis, physics, and LED device of layer-controlled colloidal quantum wells (CQWs) of organic-inorganic hybrid lead halide perovskites (OIHPs), the two-dimensional nanocrystals of OIHP in colloidal solution. Our results have suggested that the materials system might be the ultimate solution for the quantum-dot based LEDs. We found that the CQWs possess: (i) the aggregation-induced emission (AIE) characteristics, boosting the film PLQY up to 97%, and (ii) the emission directionality (ED) perpendicular to the substrate plane in their self-assembled superlattices. Based on the new photophysical properties that have never been foundin any other CQD systems, in this proposal, we aim to optimally utilize the characteristics of the AIE and ED, in order to realize high-efficiency and long-lifetime LED technology that can fulfill 100% Rec. 2020 color gamut.",Chih-Jen Shih,Swiss Federal Institute of Technology Zurich (ETH Zurich),Switzerland,-,849229,ERC-2019-STG,Starting Grants,Physical sciences & engineering (PE),PE8 - Products & Processes Engineering,2019,43831,45657,1498515,https://cordis.europa.eu/project/id/849229,ETH Zurich
Horizon 2020,DESCALE,De-railing scaling: From fundamentals of crystallization fouling on nano-materials to rational design of scale-phobic surfaces,"Crystallization fouling, a process where scale forms on surfaces, is pervasive in nature and technology, negatively impacting the energy conversion and water treatment industries. Despite significant efforts, rationally designed materials that are intrinsically resistant to crystallization fouling without the use of active methods like antiscalant additives (which can persist long after their disposal and the toxicological impact of which in effluent is questioned) remain elusive. This is because antiscalant surfaces are constructed today without sufficient reliance on an intricate but necessary science-base, of how interweaved interfacial thermofluidics, nucleation thermodynamics, and surface nanoengineering control the onset of nucleation and adhesion of frequently encountered scaling salts like calcium carbonate and calcium sulfate. Such scaling salts are common components of fouling deposits in industrial heat exchangers and membranes, which significantly inhibit heat transfer and flow performance. Therefore, guided by interfacial thermofluidic and thermodynamics theories, and employing advanced experimental methods in the areas of surface nanoengineering and diagnostics, this project will develop an integrated knowledge-base for how engineered surfaces can beneficially interact with interfacial transport phenomena in order to significantly advance antiscalant surfaces. We aim to pinpoint mechanisms for inhibiting scale nucleation and reducing adhesion in order to design and engineer antiscalant materials based on the collaborative action of their composition and topography. The effects of surface texture curvature, surface composition, and substrate compliance on scale nucleation and adhesion have intertwined and sometimes competing impacts, which we aim at elucidating to realize high performance scale-phobic surfaces. Connected to this are cutting edge materials fabrication techniques and considerations to the development of surfaces for future applications.",Thomas Schutzius,Swiss Federal Institute of Technology Zurich (ETH Zurich),Switzerland,-,853257,ERC-2019-STG,Starting Grants,Physical sciences & engineering (PE),PE8 - Products & Processes Engineering,2019,43862,45991,1963625,https://cordis.europa.eu/project/id/853257,ETH Zurich
Horizon 2020,NanoBiOptics,A Synthetic Biology Approach to Developing Optical NanoAnalytics,"Bioengineering is the synthetic biologist’s approach to engineering materials. It allows researchers to overcome billions of years of evolution to create unnatural biomolecules equipped with interactions unfounded in nature. Biomolecules offer unparalleled molecular recognition that can be tuned by engineers to create highly specific sensors. Unfortunately, biology has its limits; many biological optical sensors rely on fluorophores with limited lifetimes and visible emissions that overlap with tissue absorption. Unlike these fluorophores, single-walled carbon nanotubes benefit from fluorescence that is indefinitely photostable, demonstrating sensitivities that can detect analytes down to the single molecule. Their near-infrared wavelengths are also transparent to tissue absorption, allowing for continuous in vivo sensing. Unfortunately, these nanomaterials lack the molecular recognition biology has to offer.

In a sense, the advantages and disadvantages posed by the fields of bio- and nano-materials engineering are highly complementary. This proposal envisions a new generation of NanoBiOptic devices – devices that exploit the synergy of nano-bio hybrids – for sensing applications. We aim to bring to the nanosensor community what directed evolution has brought to chemistry; a guided approach to tuning interactions. We apply bioengineering techniques, such as artificial nucleic acid design as well as directed evolution, to circumvent current limitations in engineering nanosensors. In demonstrating these techniques, we realize previously intractable optical platforms for bioanalyte detection, as well as a single-molecule basis for imaging DNA-protein interactions, such as those found in CRISPR. Synthetic biology thus has the potential to complement the physical sciences in the engineering of new synthetic optical platforms, enabling a “revolution through evolution” of synthetic nanomaterials.",Ardemis Boghossian,Swiss Federal Institute of Technology Lausanne (EPFL),Switzerland,-,853005,ERC-2019-STG,Starting Grants,Physical sciences & engineering (PE),PE8 - Products & Processes Engineering,2019,44105,45930,1499495,https://cordis.europa.eu/project/id/853005,EPF Lausanne
Horizon 2020,NanoMMs,Solution-Based Engineering of Nanodimensional Phase-Change Materials and Memory Devices,"Phase-change memory (PCM) is a recently-commercialized next-generation memory storage technology that provides a sustainable solution to exponentially-growing memory storage demands of modern society. It is based on resistively switched structural changes of memory cell upon local crystallization and melting phase transitions, resulting in amorphous or crystalline atomic structures with distinctly different “0” and “1” resistance states. PCM is faster and more durable than state-of-the-art non-volatile memory devices like silicon-based solid-state drives (SSD), and it can furthermore be scaled in all three dimensions. However, there are open challenges for PCM technology, such as large power consumption and high price of PCM devices, which stem from large dimensions of memory cells, complex fabrication process, and from use of material-inefficient sputtering and etching fabrication steps for the expensive PCM layer.
This proposal addresses the open challenges and enables further development of PCM technology by applying solution-based engineering. Our goals are (i) to develop robust synthetic approaches for PCM materials, such as ternary tellurides and antimony-rich compositions, in the form of colloidal nanoparticles and molecular ink precursors; (ii) to thoroughly study how PCM properties change at the nanoscale as a function of size, thickness, and composition; and (iii) to employ these phase-change nanomaterials in solution-processed PCM arrays to build new, ultrasmall PCM configurations as well as multilayer PCM cells and to reduce their price and power consumption.",Maksym Yarema,Swiss Federal Institute of Technology Zurich (ETH Zurich),Switzerland,-,852751,ERC-2019-STG,Starting Grants,Physical sciences & engineering (PE),PE8 - Products & Processes Engineering,2019,43831,45657,1604600,https://cordis.europa.eu/project/id/852751,ETH Zurich
Horizon 2020,TAMING CORROSION,Towards mastering the long-standing challenge of ageing infrastructures in corrosive environments,"TAMING CORROSION proposes a radically new approach to the long-standing challenge of mitigating corrosion of infrastructures – such as bridges, pipelines, etc. The socio-economic burden of replacing and repairing infrastructures due to corrosion is staggering. In the EU alone, estimates are in the range of 250 billion € annually, with an expected steep increase over the coming decades. This urgently calls for new, cost-effective corrosion mitigation strategies to prolong the useful life of ageing civil infrastructures. Electrochemical corrosion protection (ECP) methods have a large potential to play a key role in addressing this challenge. However, to match these expectations, game-changing advances are needed in both science and engineering. Limited routine use and poor engineering practice of ECP can be traced to insufficient theoretical grounds and a lack of fundamental quantification of key processes. The aim of this proposal is to develop the scientific basis to deliver the first scientifically anchored engineering model and to unlock the potential of ECP as an innovative solution to the grand challenge of rapidly deteriorating infrastructures. The focus areas include: 1) for the first time integrating all relevant physical, chemical, and electrochemical processes into a quantitative model framework for the systematic study of fundamental processes and evaluation of solution strategies. An important novelty lies in combining reactive transport modeling in porous media with rigorous corrosion science. 2) Elucidating the poorly understood role of microbiology in corrosion; and 3) Devising new experiments that link corrosion science and electrochemistry with environmental science methods. Only by delivering ground-breaking scientific contributions will it be possible to abandon empiricism in the field and pave the way towards a new, scientifically sound generation of ECP technology to ensure safety, cost-efficiency, and sustainability of our infrastructures.",Ueli Angst,Swiss Federal Institute of Technology Zurich (ETH Zurich),Switzerland,-,848794,ERC-2019-STG,Starting Grants,Physical sciences & engineering (PE),PE8 - Products & Processes Engineering,2019,43831,45657,1497815,https://cordis.europa.eu/project/id/848794,ETH Zurich
